{"artifacts":[{"path":"site/index.html","sha256":"d78670e5b9c9b72a18a8839540332d6ede710d1ada0390502db16ac88d8f618b"}],"collection":{"collection_id":"author-works","release_id":"sha256:646d6b43072e15b4","sha256":"c1a5c7af5f9d59d80a15a00dc8045c4e37157aba67682bb7d776c81340e326b5"},"experience_id":"author-works","payload_sha256":"799a247b0ed2f161563bc1bb790b1745b73bae15167161bb528c123186eae40b","release_id":"sha256:799a247b0ed2f161","renderer":{"name":"static-navigator"},"schema_id":"knowledge.experience-release","schema_version":1,"spec_sha256":"edc6ef33f95c90069f5f1442c371876d2b989c70dbb28be3b0a180e0e011f6f5"}
