{"artifacts":[{"path":"site/index.html","sha256":"399aa5c1927d4fb048a88a3b3f2d3cb418c8da2f5a19185866544c40c6f46232"}],"collection":{"collection_id":"aggregation-public-explainer","release_id":"sha256:e14a4ad79268dee7","sha256":"181c665f9633282d6d949c3acc6cb4f435946a39962312d644c4abf2f7dd815b"},"experience_id":"aggregation-public-explainer","payload_sha256":"83f3f6488ac35597bfec166b7f2b2cc945e8f3eb8afd1be238234dda2a34af09","release_id":"sha256:83f3f6488ac35597","renderer":{"name":"static-navigator"},"schema_id":"knowledge.experience-release","schema_version":1,"spec_sha256":"62e7b029bcd81e2f2fe469c9eecc37e6787dece27307624a13c7287c43cd8ebb"}
