{"artifacts":[{"path":"site/index.html","sha256":"5a99c59f74774872d5a3c8da68ad985ed9176fc22829b0bce3f810abd8fdb32e"}],"collection":{"collection_id":"working-memory-journal","release_id":"sha256:1cdee66182d2514e","sha256":"1d4d8cdaf4a5b82ff8f32dab63cdc6df7154b148e3ede13a03be3c8e525370c7"},"experience_id":"working-memory-journal-frozen-publication-inventory","payload_sha256":"943be14e62f6a14f9db6442ab492b5f0c32712258515ad4bf3f5dcbb4fc98496","release_id":"sha256:943be14e62f6a14f","renderer":{"name":"static-navigator"},"schema_id":"knowledge.experience-release","schema_version":1,"spec_sha256":"4433f8ba26e495129b9a7afe272ddcc9f80d3a1c629b2929e184aad65d026884"}
