{"artifacts":[{"path":"site/index.html","sha256":"c933aaa087e52dd9fbc868ccfe7fcfe2990575fa3014222d2f04423798c9a82f"}],"collection":{"collection_id":"fcv-literature-corpus","release_id":"sha256:010486a65a5888d2","sha256":"094d51ab32235e1792f0c218d7aea09e97c82544529ee65967c742bda44716c2"},"experience_id":"fcv-literature-corpus","payload_sha256":"8a7b561e877d1c827711942eb634b2c37f63a6e49e98064e7c2b04692cdd859c","release_id":"sha256:8a7b561e877d1c82","renderer":{"name":"static-navigator"},"schema_id":"knowledge.experience-release","schema_version":1,"spec_sha256":"adabcb43b23e9753553b53dc782f9ecc575ce10625b3ea0b122fdcabdf6e2023"}
