{"artifacts":[{"path":"site/index.html","sha256":"319c680845f7e692555dd5971d8932b8b0db2ac5c736d3b03edeac1e83277e0f"}],"collection":{"collection_id":"economics-of-aggregation-programme","release_id":"sha256:3c46140540fd493c","sha256":"ed50d7f19018c7cd0ae7ae498cb70dc175a6791400473311e8e928e0ef159262"},"experience_id":"economics-of-aggregation-frozen-index","payload_sha256":"e48e77652ca1c927bbc53b5290de0a5e2af6128dedc0b4f4c6341d0f639e42c4","release_id":"sha256:e48e77652ca1c927","renderer":{"name":"static-navigator"},"schema_id":"knowledge.experience-release","schema_version":1,"spec_sha256":"d7f95ebe71c51312dbdf3ddbc51c6430ee1c95b9b8767ded6cb9325647d92311"}
