{"artifacts":[{"path":"site/index.html","sha256":"d9b6345bdfeed25df376eca4bcfd40827bcace77b7e4cddf6536e86160c6ae57"}],"collection":{"collection_id":"lcd-thesis-resources-live","release_id":"sha256:01bbef6b349aefea","sha256":"8c443b284911c93f8f460b4fd270da0fa722e934f20adffed9c5e6fa9c7bbbea"},"experience_id":"lcd-thesis-resources-live","payload_sha256":"3b69509ac61a991fa10d69982a2e253d5f818375f72a5c336841d274cc149a71","release_id":"sha256:3b69509ac61a991f","renderer":{"name":"static-navigator"},"schema_id":"knowledge.experience-release","schema_version":1,"spec_sha256":"b8a817b01f8d06caf87000cdd9772cbdc4206fe551cbe0ee0d9114b6981fb630"}
