{"artifacts":[{"path":"site/index.html","sha256":"fbee88a9092a022f70c3c6224e04c28e6ef5e7ff3f99b2205c3348be92ef1580"}],"collection":{"collection_id":"ldd-uba-exercise-catalog","release_id":"sha256:099e370174316de7","sha256":"014580c0d2a572bac96230f8d1b7275609d93d0241de898d594900e40a57174f"},"experience_id":"ldd-uba-frozen-exercise-catalog","payload_sha256":"24c5001976808e1076a535272615dc009d6ae6fd9374eb49482945a834309748","release_id":"sha256:24c5001976808e10","renderer":{"name":"static-navigator"},"schema_id":"knowledge.experience-release","schema_version":1,"spec_sha256":"30b9073b72a17e28a27a7ab202c745b711974e520b3e9b0e89b51c40c3a90b6f"}
