{"artifacts":[{"path":"site/index.html","sha256":"71e18f6b0fbee3b464bd076b9f7cc76ab3253ead3e1255dacaa5eaca41284eeb"}],"collection":{"collection_id":"lcd-institutional-live","release_id":"sha256:582187c7ac71a101","sha256":"abfb3ea273ce0469ee97e115f25e3f902814acd53cf08ba942db456aec36aeff"},"experience_id":"lcd-institutional-live","payload_sha256":"e5f0d7ad9f42ab8fd799f2b849b35e0602e1a23d93945598018157e3b77e86b7","release_id":"sha256:e5f0d7ad9f42ab8f","renderer":{"name":"static-navigator"},"schema_id":"knowledge.experience-release","schema_version":1,"spec_sha256":"f1727031d9c5209209e275965f15956bdec4b1a936197fd579f3cca3eaded22a"}
