{"artifacts":[{"path":"site/index.html","sha256":"b41299b32c17453069ffd8a5cbccf5cd2e22e78683f2317ad1be773efe4c2bfe"}],"collection":{"collection_id":"economic-complexity-reading-path","release_id":"sha256:1301c8bd650a44c7","sha256":"82d462b9af612b33c95dd3c1197292cb6d7ea55585228551ffcec37b7bf8a6d8"},"experience_id":"economic-complexity-reading-path","payload_sha256":"b1fe6ed6d4ee4230f1c36f16ef63333862c3c402933e33934dec804bf493c88a","release_id":"sha256:b1fe6ed6d4ee4230","renderer":{"name":"static-navigator"},"schema_id":"knowledge.experience-release","schema_version":1,"spec_sha256":"25ecda8bcd3c184e0161a82be37030798e66643101b502fd79efd4ef871e0365"}
