{"artifacts":[{"path":"site/index.html","sha256":"9e004afd0f5fc1b410e1fee1d7f7830db7ff676b3cdc10d9003434a74f319052"}],"collection":{"collection_id":"thesis-bibliography","release_id":"sha256:a766463507d2f5cc","sha256":"d90919fb044cb8369d6c72b61104fbb575fce9acd110267430fed8c7a5cf2f94"},"experience_id":"thesis-bibliography","payload_sha256":"a6289e933594e505a07ecf91a77c8846a6f2a22a2a7db55e4ea5d48d3715cd8c","release_id":"sha256:a6289e933594e505","renderer":{"name":"static-navigator"},"schema_id":"knowledge.experience-release","schema_version":1,"spec_sha256":"d751d5b368187a37d045ffddd43f349a15eeb2661b3b465d8398e39747f88211"}
